{
  "authority_action_code": "record_no_status_change",
  "authority_effect_code": "no_authoritative_status_change",
  "consequences": [
    {
      "action_code": "no_correction_reassessment",
      "claim_id": "neutral-a",
      "classification": "unaffected"
    },
    {
      "action_code": "no_correction_reassessment",
      "claim_id": "neutral-b",
      "classification": "unaffected"
    },
    {
      "action_code": "no_correction_reassessment",
      "claim_id": "neutral-c",
      "classification": "unaffected"
    },
    {
      "action_code": "no_correction_reassessment",
      "claim_id": "neutral-d",
      "classification": "unaffected"
    }
  ],
  "evidence_bindings": [
    {
      "path": "evidence/neutral-a.json",
      "sha256": "sha256:6774848b727353198110e3f7dfa71df2f310a716cba11ccc0313a48a92d2c74e"
    },
    {
      "path": "evidence/neutral-b.json",
      "sha256": "sha256:ffb8ec11a1c514218df8d8cf7f3b2935f0a9955663139e0535fa7a9fd99913ed"
    },
    {
      "path": "evidence/neutral-c.json",
      "sha256": "sha256:60d4a6123b3f7f6dfa0d80be8e28277f958c1d52454e52d069e1bdbbd72a8df7"
    },
    {
      "path": "evidence/neutral-d.json",
      "sha256": "sha256:143357b610df16089d6e8375551c82663f6482e3d8bab8f06cab126bc524adea"
    }
  ],
  "family_id": "neutral-schema-compatibility",
  "predecessor_claim_id": "neutral-old",
  "schema": "inherited-correction-held-out-response.v1",
  "successor_claim_id": "neutral-new"
}
